Name,Title,Email
"Alain Kassab, Ph.D.",Professor (Mechanical & Aerospace Eng.),alain.kassab@ucf.edu
"Kiminobu Sugaya, Ph.D.",Professor (Burnett School of Biomedical Sciences),kiminobu.sugaya@ucf.edu
"Swaminathan Rajaraman, Ph.D.",Associate Professor (Materials Science & Eng.),swaminathan.rajaraman@ucf.edu
"Melanie Coathup, Ph.D.",Professor (College of Medicine & BME affiliate),melanie.coathup@ucf.edu
"Kaitlyn Crawford, Ph.D.",Assistant Professor (Materials Science & Eng.),kaitlyn.crawford@ucf.edu
