Name,Title,Email
Parastoo Abtahi,Assistant Professor of Computer Science,
Ryan P. Adams,Professor of Computer Science,
Andrew W. Appel,Eugene Higgins Professor of Computer Science (Emeritus),
Sanjeev Arora,Charles C. Fitzmorris Professor of Computer Science,
David I. August,Professor of Computer Science,
Danqi Chen,Associate Professor of Computer Science,
Jia Deng,Assistant Professor of Computer Science,
Jennifer Rexford,Gordon Y.S. Wu Professor of Engineering (Computer Science),
Kai Li,Charles Fitzmorris Professor of Computer Science,
Olga Russakovsky,Assistant Professor of Computer Science,
